{
  "case_id": "VP-DEMO-001",
  "request_id": "req_report_init_demo_001",
  "schema_version": "1.0",
  "model": "fixture/report-initializer",
  "model_version": "1.0",
  "result": {
    "report_type": "LIVE",
    "sections": [
      {
        "section_key": "summary",
        "operation": "UPSERT",
        "content": {
          "text": "검찰 사칭과 긴급 송금 요구 정황이 확인되어 즉시 사실 확인이 필요한 고위험 사건입니다."
        },
        "source_ids": ["input_demo_001", "seg_demo_001"]
      },
      {
        "section_key": "risk_context",
        "operation": "UPSERT",
        "content": {
          "risk": "HIGH",
          "signals": ["검찰 사칭", "송금 요구"]
        },
        "source_ids": ["feature_demo_impersonation", "feature_demo_transfer_request"]
      },
      {
        "section_key": "transfer_status",
        "operation": "UPSERT",
        "content": {
          "status": "UNKNOWN",
          "amount": null
        },
        "source_ids": []
      },
      {
        "section_key": "exposure_status",
        "operation": "UPSERT",
        "content": {
          "credential_exposure": "UNKNOWN",
          "remote_control": "UNKNOWN"
        },
        "source_ids": []
      },
      {
        "section_key": "verification_status",
        "operation": "UPSERT",
        "content": {
          "status": "NEEDS_VERIFICATION",
          "items": []
        },
        "source_ids": []
      },
      {
        "section_key": "current_actions",
        "operation": "UPSERT",
        "content": {
          "items": []
        },
        "source_ids": []
      },
      {
        "section_key": "unresolved_items",
        "operation": "UPSERT",
        "content": {
          "items": ["송금 여부", "금액", "개인정보 또는 원격제어 앱 노출 여부"]
        },
        "source_ids": []
      },
      {
        "section_key": "next_checks",
        "operation": "UPSERT",
        "content": {
          "items": ["송금 여부를 확인한다.", "공식 연락처로 기관 사칭 여부를 확인한다."]
        },
        "source_ids": []
      }
    ]
  },
  "warnings": [],
  "processing_ms": 0
}
